{
  "$schema": "../schemas/profile-catalog.schema.json",
  "apiVersion": "northgate/v1alpha1",
  "kind": "BootstrapCatalog",
  "catalogVersion": "2026.08.01.1",
  "profiles": [
    {
      "id": "none",
      "serverPolicyId": "ng-bootstrap-none-v1",
      "approvalStatus": "approved"
    },
    {
      "id": "debian12-employee-hub",
      "serverPolicyId": "ng-bootstrap-debian12-employee-hub-v1",
      "approvalStatus": "proposed"
    },
    {
      "id": "debian12-sentinel-atlas",
      "serverPolicyId": "ng-bootstrap-debian12-sentinel-atlas-v1",
      "approvalStatus": "proposed"
    }
  ]
}
