{
  "$schema": "../schemas/profile-catalog.schema.json",
  "apiVersion": "northgate/v1alpha1",
  "kind": "FirmwareCatalog",
  "catalogVersion": "2026.09.04.1",
  "profiles": [
    {
      "id": "windows-gen2",
      "serverPolicyId": "ng-firmware-windows-gen2-v1",
      "approvalStatus": "approved"
    },
    {
      "id": "linux-gen2",
      "serverPolicyId": "ng-firmware-linux-gen2-v1",
      "approvalStatus": "approved"
    },
    {
      "id": "kali-gen2-unsigned",
      "serverPolicyId": "ng-firmware-kali-gen2-unsigned-v1",
      "approvalStatus": "approved"
    },
    {
      "id": "firewall-gen2",
      "serverPolicyId": "ng-firmware-firewall-gen2-v1",
      "approvalStatus": "proposed"
    },
    {
      "id": "rmm-linux-gen2-vtpm",
      "serverPolicyId": "ng-firmware-rmm-linux-gen2-vtpm-v1",
      "approvalStatus": "approved"
    }
  ]
}
